{
  "schema_version": 1,
  "policy_id": "projectkoios.code.python",
  "policy_version": "0.1.0",
  "status": "Draft",
  "title": "Project Koios Python code policy",
  "authority": {
    "source_format": "json",
    "projection_format": "markdown",
    "source_path": "docs/policies/code/python.json",
    "projection_path": "docs/policies/code/python.md",
    "projection_status": "generated"
  },
  "purpose": "Define the default Python object model and selected implementation practices for Project Koios owner repositories.",
  "scope": [
    "New or materially changed Python production code owned by Project Koios repositories.",
    "Architecture records that classify Python classes by role.",
    "Repository-local documentation tooling implemented in Python."
  ],
  "exclusions": [
    "Automatic repository-wide taxonomy renames or style rewrites of existing code.",
    "Scientific acceptance or correctness of domain algorithms.",
    "Replacement of owner-repository validation commands.",
    "A behavior-bearing universal object framework or required BaseObject class.",
    "Unannounced removal of existing public package re-exports."
  ],
  "precedence": [
    "Accepted contracts and architecture decisions.",
    "The owning repository's AGENTS.md and pyproject.toml.",
    "This Project Koios Python policy.",
    "Selected guidance from the Google Python Style Guide."
  ],
  "object_model": {
    "flow": [
      "data_object_action_request",
      "data_object_actionizer",
      "data_object_action_result"
    ],
    "base_object_classification": {
      "display_name": "BaseObject",
      "public_base_required": false,
      "members": [
        "DataObject",
        "DataObjectActionizer"
      ],
      "meaning": "BaseObject is the architecture classification for the thin struct-like and function-like object boundaries; no public BaseObject class or inheritance edge is required."
    },
    "public_abcs": {
      "module": "projectkoios.base",
      "hierarchy": [
        "DataObject(ABC)",
        "DataObjectModel(DataObject, ABC)",
        "DataObjectActionRequest(DataObjectModel, ABC)",
        "DataObjectActionResult(DataObjectModel, ABC)",
        "DataObjectActionizer[RequestT: DataObjectActionRequest, ResultT: DataObjectActionResult](ABC)"
      ],
      "action_method": "action(*, request: RequestT) -> ResultT",
      "rules": [
        "These ABCs are intentionally thin and distinguish struct-like represented state from function-like behavior.",
        "DataObject uses an abstract initializer boundary so concrete dataclasses or explicit constructors provide complete represented state.",
        "DataObjectActionizer owns the abstract action method and is not a DataObject.",
        "Actionizer is the noun that does the action: the performer or agent, not the action itself and not merely a suffix transformation.",
        "A concrete implementation inherits DataObjectActionizer[Request, Result] while retaining a meaningful agent noun such as Composer, Processor, Reconciler, Executor, Validator, Detector, Projector, Coordinator, Assembler, Recognizer, Checker, or Ingester.",
        "The module adds no BaseObject class, registry, discovery mechanism, persistence behavior, or serialization behavior."
      ]
    },
    "roles": [
      {
        "role_id": "data_object",
        "display_name": "DataObject",
        "default_python_form": "thin ABC implemented by a struct-like record",
        "responsibilities": [
          "Provide the nominal boundary for represented domain state or values.",
          "Validate intrinsic field invariants in the concrete implementation.",
          "Expose cheap, deterministic, unsurprising invariant methods and derived properties when useful."
        ],
        "prohibitions": [
          "Filesystem, network, process, clock, or database effects.",
          "Ambient discovery or mutable global state.",
          "Generic persistence, rendering, or serialization behavior.",
          "Cross-object policy or scientific acceptance decisions."
        ]
      },
      {
        "role_id": "data_object_action_request",
        "display_name": "DataObjectActionRequest",
        "default_python_form": "frozen, slotted DataObjectModel with explicit identities",
        "responsibilities": [
          "Represent the complete immutable intent for one domain operation.",
          "Identify the operation contract and version, every input DataObject, operation parameters, and any applicable domain model.",
          "Provide a request identity derived from represented intent rather than execution time, attempt number, or outcome."
        ],
        "prohibitions": [
          "Live clients, open resources, stores, clocks, or dependency containers.",
          "Execution results, mutable progress, or retry state.",
          "Implicit discovery of a DataObject or domain model.",
          "Transport-specific response fields."
        ]
      },
      {
        "role_id": "data_object_actionizer",
        "display_name": "DataObjectActionizer",
        "default_python_form": "thin generic ABC implemented by a function-like domain operation",
        "responsibilities": [
          "Perform one named domain operation expressed by an exact DataObjectActionRequest.",
          "Own cross-object policy and operation-specific validation.",
          "Receive stores, clocks, clients, configuration, and authority explicitly.",
          "Return one typed DataObjectActionResult from action(*, request=...)."
        ],
        "prohibitions": [
          "Service-location globals or reflective actionizer discovery.",
          "Hidden mutable state unrelated to documented immutable configuration.",
          "A generic registry that erases domain ownership.",
          "DataObject inheritance or represented-state responsibilities."
        ]
      },
      {
        "role_id": "data_object_action_result",
        "display_name": "DataObjectActionResult",
        "default_python_form": "frozen, slotted DataObjectModel with closed outcome",
        "responsibilities": [
          "Represent the immutable outcome of one exact request processed by one identified actionizer contract.",
          "Bind the request, actionizer implementation or contract, configuration, domain-model, output, and evidence identities that apply.",
          "Represent expected domain failure using a closed outcome vocabulary.",
          "State limitations without implying human or scientific acceptance."
        ],
        "prohibitions": [
          "Invented success values after an indeterminate or rejected operation.",
          "Conflation with a workflow ResultObject unless the owner contract states both roles.",
          "Unbounded exception text as the only machine-readable failure representation.",
          "Mutation of the request or any input DataObject."
        ]
      }
    ],
    "data_object_model": {
      "role_id": "data_object_model",
      "display_name": "DataObjectModel",
      "relationship": "DataObjectModel is the public DataObject ABC specialization for immutable struct-like DataObjects; every DataObjectActionRequest and DataObjectActionResult inherits it.",
      "rules": [
        "Concrete DataObjectModel implementations use an immutable form such as dataclass(frozen=True, slots=True) unless a documented domain requirement needs another implementation.",
        "DataObjectModel describes immutable domain structure; it does not mean a Pydantic boundary model, ORM model, or machine-learning model unless the owning domain explicitly assigns that meaning.",
        "A separate domain-model object is introduced only when its independent identity, version, invariants, or reuse are part of the operation contract.",
        "DataObjectModel owns no external effects and does not replace the actionizer."
      ]
    },
    "rules": [
      "BaseObject is a classification, not a required public base class; DataObject and DataObjectActionizer both fill that classification.",
      "The five thin public ABCs and their exact hierarchy are defined in projectkoios.base; concrete domain classes inherit the applicable ABC while retaining domain names.",
      "DataObjectActionizer is the functional ABC and architecture role, not a mandatory concrete class-name suffix.",
      "Request and Result names share a coherent domain-operation stem, for example ScientificMarkdownRenderRequest and ScientificMarkdownRenderResult; the implementation uses its accurate behavior noun, such as ScientificMarkdownRenderer.",
      "Concrete Composer, Processor, Reconciler, Executor, Validator, Detector, Projector, Coordinator, Assembler, Recognizer, Checker, and Ingester names are domain-specific Actionizers when they accurately describe the implemented verb.",
      "Do not introduce an intermediate FooActionizer class solely to attach the architecture label.",
      "The inherited action(*, request) method is the uniform functional boundary; an existing meaningful domain verb such as compose, process, reconcile, or execute may remain the meaningful API, with one method delegating to the other and no duplicated operation logic.",
      "Do not deprecate a meaningful implementation noun or semantic method merely because the class now inherits DataObjectActionizer; compatibility aliases are reserved for genuinely superseded type names such as Input renamed to Request.",
      "Request and result identity are distinct: repeated processing of one request may yield separately identified results when execution evidence, external state, or outcomes differ.",
      "Result is the internal domain term; Response is reserved for a transport boundary such as HTTP, where an adapter maps a result to a response schema.",
      "In a touched bounded family, implementation helpers are private instance, staticmethod, or classmethod behavior on the DataObject or concrete Actionizer that owns the invariant or action.",